{
  "country": "USA",
  "election_type": "Presidential Election",
  "steps": [
    {
      "id": 1,
      "title": "Primary Elections and Caucuses",
      "description": "Each state holds primary elections or caucuses where registered party members vote for their preferred presidential candidate. Delegates are awarded proportionally or on a winner-take-all basis depending on state and party rules.",
      "description_beginner": "Each state holds a vote where people pick who they want their party's candidate to be for president.",
      "duration": "February - June (election year)",
      "responsible_party": "State Governments and Political Parties",
      "key_terms": ["Primary", "Caucus", "Delegate"],
      "did_you_know": "Iowa has traditionally held the first caucus, but in 2024, South Carolina became the first Democratic primary."
    },
    {
      "id": 2,
      "title": "National Conventions",
      "description": "Each major party holds a national convention where delegates formally nominate the presidential and vice-presidential candidates. The party platform is also adopted at the convention.",
      "description_beginner": "Each party holds a big meeting to officially choose their candidate for president and decide what issues they care about.",
      "duration": "4 days each (July - August)",
      "responsible_party": "Democratic and Republican National Committees",
      "key_terms": ["Convention", "Nomination", "Party Platform"],
      "did_you_know": "The first televised national convention was in 1952, and it dramatically changed how campaigns reached voters."
    },
    {
      "id": 3,
      "title": "General Election Campaign",
      "description": "Nominated candidates from both parties campaign nationwide through debates, rallies, advertisements, and ground operations, focusing heavily on swing states.",
      "description_beginner": "The chosen candidates travel around the country trying to convince people to vote for them, with debates and ads.",
      "duration": "September - early November",
      "responsible_party": "Presidential Candidates and Campaigns",
      "key_terms": ["Swing State", "Debate", "Super PAC", "Campaign Trail"],
      "did_you_know": "The first presidential debate was between Kennedy and Nixon in 1960. Radio listeners thought Nixon won, but TV viewers favored Kennedy."
    },
    {
      "id": 4,
      "title": "Election Day",
      "description": "Voters cast ballots at polling places or through early/mail-in voting. The popular vote in each state determines which candidate receives that state's electoral votes.",
      "description_beginner": "People go to voting places or mail in their ballots to pick the president. Each state counts its votes separately.",
      "duration": "First Tuesday after the first Monday in November",
      "responsible_party": "State and Local Election Officials",
      "key_terms": ["Ballot", "Polling Place", "Early Voting", "Mail-in Ballot"],
      "did_you_know": "Election Day was set on a Tuesday in 1845 because farmers needed a day to travel to polling places and Wednesday was market day."
    },
    {
      "id": 5,
      "title": "Electoral College Vote",
      "description": "Electors from each state formally cast their electoral votes in December. A candidate needs 270 out of 538 electoral votes to win the presidency.",
      "description_beginner": "Special representatives from each state officially vote for president in December. A candidate needs 270 votes to win.",
      "duration": "First Monday after the second Wednesday in December",
      "responsible_party": "Presidential Electors",
      "key_terms": ["Electoral College", "Elector", "Faithless Elector"],
      "did_you_know": "There have been 165 instances of faithless electors in US history, though none have ever changed the outcome of an election."
    },
    {
      "id": 6,
      "title": "Inauguration",
      "description": "The president-elect is sworn into office on January 20th at the U.S. Capitol. The oath of office is administered by the Chief Justice of the Supreme Court.",
      "description_beginner": "The new president takes an oath and officially starts the job on January 20th at a big ceremony in Washington, D.C.",
      "duration": "January 20 (following year)",
      "responsible_party": "Joint Congressional Committee on Inaugural Ceremonies",
      "key_terms": ["Inauguration", "Oath of Office", "Transition"],
      "did_you_know": "The longest inaugural address was by William Henry Harrison in 1841 at 8,445 words. He died 31 days later from pneumonia."
    }
  ],
  "timeline": {
    "phases": [
      {"id": 1, "name": "Primary Season", "start_offset_days": -300, "end_offset_days": -150, "color": "#1565C0", "description": "State primaries and caucuses to select party nominees."},
      {"id": 2, "name": "Convention and Campaign", "start_offset_days": -150, "end_offset_days": -7, "color": "#F57C00", "description": "National conventions, debates, and the general election campaign."},
      {"id": 3, "name": "Election Day", "start_offset_days": -1, "end_offset_days": 0, "color": "#2E7D32", "description": "Voters cast ballots across all 50 states and territories."},
      {"id": 4, "name": "Transition Period", "start_offset_days": 1, "end_offset_days": 75, "color": "#7B1FA2", "description": "Electoral College vote, certification, and presidential transition."}
    ]
  },
  "roles": [
    {"name": "Federal Election Commission", "abbreviation": "FEC", "description": "Independent regulatory agency that enforces campaign finance laws in federal elections.", "powers": ["Enforce campaign finance limits", "Require financial disclosures", "Investigate campaign violations"]},
    {"name": "Secretary of State", "abbreviation": "SoS", "description": "The chief election official in most states, responsible for overseeing election administration.", "powers": ["Certify election results", "Manage voter registration", "Oversee ballot design and printing"]},
    {"name": "Electoral College", "abbreviation": "EC", "description": "The body of 538 electors who formally elect the president and vice president.", "powers": ["Cast electoral votes", "Formally elect the president"]}
  ],
  "key_terms": [
    {"term": "Electoral College", "full_form": "United States Electoral College", "definition": "A body of 538 electors who formally elect the president. Each state gets electors equal to its congressional delegation.", "introduced": 1787},
    {"term": "Super PAC", "full_form": "Super Political Action Committee", "definition": "An independent committee that can raise unlimited funds for political advertising but cannot coordinate with candidates.", "introduced": 2010},
    {"term": "Swing State", "full_form": "Battleground State", "definition": "A state where both major party candidates have a realistic chance of winning, making it a focus of campaign efforts."},
    {"term": "Gerrymandering", "full_form": "Gerrymandering", "definition": "The practice of drawing electoral district boundaries to favor one party over another.", "introduced": 1812},
    {"term": "Filibuster", "full_form": "Filibuster", "definition": "A tactic used in the Senate to delay or block legislation by extending debate indefinitely."}
  ],
  "quiz": [
    {"id": 1, "question": "How many electoral votes are needed to win the US presidency?", "options": ["218", "270", "326", "435"], "correct_index": 1, "explanation": "A candidate needs 270 out of 538 electoral votes to win the presidency."},
    {"id": 2, "question": "When is US Election Day?", "options": ["First Monday in November", "First Tuesday after the first Monday in November", "November 1st", "Last Tuesday in October"], "correct_index": 1, "explanation": "Election Day falls on the first Tuesday after the first Monday in November."},
    {"id": 3, "question": "What is a caucus?", "options": ["A type of ballot", "A local party meeting to select candidates", "A court ruling", "A campaign advertisement"], "correct_index": 1, "explanation": "A caucus is a local meeting where party members gather to discuss and vote on candidates."},
    {"id": 4, "question": "Who administers the presidential oath?", "options": ["Vice President", "Speaker of the House", "Chief Justice", "Secretary of State"], "correct_index": 2, "explanation": "The Chief Justice of the Supreme Court administers the presidential oath of office."},
    {"id": 5, "question": "What is a Super PAC?", "options": ["A government agency", "A type of ballot", "An independent fundraising committee", "A voting machine"], "correct_index": 2, "explanation": "A Super PAC can raise unlimited funds for political ads but cannot coordinate with candidates."}
  ]
}
